{
  "schema_name": "petra.project-history-retained-view",
  "schema_version": "1.1.0",
  "project_id": "project_01ARZ3NDEKTSV4RRFFQ69G5FAV",
  "content": {
    "view_kind": "retained_events",
    "order_kind": "project_stream_newest_first",
    "query": {
      "limit": 1,
      "filters": {
        "family": "project_source_replacement",
        "command_name": "CreateProjectSourceReplacement",
        "event_type": "project_source.replacement_created",
        "actor_id": "actor_01ARZ3NDEKTSV4RRFFQ69G5FAV",
        "outcome": "completed",
        "effect": "source_replacement_created",
        "target": {
          "semantic_key": "petra.project-source",
          "object_id": "project_source_01K4C000000000000000000041"
        },
        "recorded_at": {
          "from_inclusive": "2026-09-10T00:00:00.000Z",
          "through_inclusive": "2026-09-10T23:59:59.999Z"
        }
      }
    },
    "cursor_binding": "project_snapshot_and_complete_query",
    "changes": [
      {
        "command_ref": {
          "command_id": "command_01K4C000000000000000000056",
          "schema_version": "1.3.0",
          "command_name": "CreateProjectSourceReplacement",
          "idempotency_key": "project-source-replacement-create-fixture-v1",
          "command_fingerprint": "sha256:aaaaaaaaaaaaaaaaaaaaaaaaaaaaaaaaaaaaaaaaaaaaaaaaaaaaaaaaaaaaaaaa",
          "capability_grant_id": "capability_grant_01K4C000000000000000000051",
          "correlation_id": "trace_01K4C000000000000000000055"
        },
        "event_ref": {
          "event_id": "event_01K4C000000000000000000057",
          "schema_version": "1.3.0",
          "event_type": "project_source.replacement_created",
          "event_position": 8,
          "stream_revision": 8,
          "record_hash": "sha256:bbbbbbbbbbbbbbbbbbbbbbbbbbbbbbbbbbbbbbbbbbbbbbbbbbbbbbbbbbbbbbbb"
        },
        "actor": {
          "actor_id": "actor_01ARZ3NDEKTSV4RRFFQ69G5FAV",
          "actor_kind": "human"
        },
        "occurred_at": "2026-09-10T00:03:00.000Z",
        "recorded_at": "2026-09-10T00:03:00.000Z",
        "family": "project_source_replacement",
        "targets": [
          {
            "role": "primary",
            "semantic_key": "petra.project-source-replacement",
            "object_id": "project_source_replacement_01K4C000000000000000000054",
            "revision": 1,
            "content_hash": "sha256:cccccccccccccccccccccccccccccccccccccccccccccccccccccccccccccccc",
            "record_hash": "sha256:dddddddddddddddddddddddddddddddddddddddddddddddddddddddddddddddd",
            "authority_state": "active"
          },
          {
            "role": "affected",
            "semantic_key": "petra.project-source",
            "object_id": "project_source_01K4C000000000000000000041",
            "revision": 2,
            "content_hash": "sha256:eeeeeeeeeeeeeeeeeeeeeeeeeeeeeeeeeeeeeeeeeeeeeeeeeeeeeeeeeeeeeeee",
            "record_hash": "sha256:ffffffffffffffffffffffffffffffffffffffffffffffffffffffffffffffff",
            "authority_state": "excluded"
          }
        ],
        "observed_effect": {
          "effect": "source_replacement_created",
          "outcome": "completed",
          "summary": "Recorded the exact successor relationship while retaining both ProjectSource identities."
        },
        "recovery": {
          "eligibility": "eligible",
          "command_name": "RetractProjectSourceReplacement",
          "expected_target_ref": {
            "semantic_key": "petra.project-source-replacement",
            "object_id": "project_source_replacement_01K4C000000000000000000054",
            "revision": 1,
            "content_hash": "sha256:cccccccccccccccccccccccccccccccccccccccccccccccccccccccccccccccc",
            "record_hash": "sha256:dddddddddddddddddddddddddddddddddddddddddddddddddddddddddddddddd"
          },
          "reason": "The exact relationship remains the active replacement head and can be retracted without restoring either source."
        },
        "semantic_destination": {
          "place_role": "history",
          "task_intent": "view_history",
          "object_ref": {
            "semantic_key": "petra.project-source-replacement",
            "object_id": "project_source_replacement_01K4C000000000000000000054",
            "revision": 1
          }
        }
      }
    ],
    "page": {
      "returned_count": 1,
      "snapshot_total_count": 3,
      "has_more": true,
      "next_cursor": "phc2.eyJ2IjoyLCJxdWVyeSI6Im9wYXF1ZSJ9.AAAAAAAAAAAAAAAAAAAAAAAAAAAAAAAAAAAAAAAAAAA"
    },
    "retention_snapshot": {
      "through_event_position": 8,
      "through_stream_revision": 8,
      "head_event_ref": {
        "event_id": "event_01K4C000000000000000000057",
        "schema_version": "1.3.0",
        "event_type": "project_source.replacement_created",
        "event_position": 8,
        "stream_revision": 8,
        "record_hash": "sha256:bbbbbbbbbbbbbbbbbbbbbbbbbbbbbbbbbbbbbbbbbbbbbbbbbbbbbbbbbbbbbbbb"
      }
    },
    "current_authority": {
      "through_event_position": 8,
      "through_stream_revision": 8
    },
    "recovery_authority": "current_at_page_read",
    "omissions": [
      "origin_filter_not_supported",
      "dependency_impact_not_composed",
      "generic_reversal_assessment_not_composed",
      "historical_project_definition_not_interpreted",
      "cross_family_total_order_not_asserted"
    ],
    "graph_navigation_history": "client_local_separate"
  },
  "content_hash": "sha256:3333333333333333333333333333333333333333333333333333333333333333",
  "read_at": "2026-09-10T00:04:00.000Z"
}
